{
    "hash_pdf": "b079ab2201c676e7f2866470293da3dd42f3b6ee9966d77057ab4bbc378e60cc",
    "cache_key": "cache_b079ab2201c676e7_f5715a1af696ce83",
    "archivo_original": "contracts_sample.pdf",
    "fecha_procesamiento": "2026-04-21T15:00:23+00:00",
    "version_pipeline": "contracts_v1_pipeline",
    "version_baremo": "contracts_v1_baremo",
    "version_schema": "contracts_v1_schema",
    "resultado_json_path": "C:\\Users\\basil\\Documents\\GitHub\\Proyecto-Acelerador\\meritos\\scraping\\tools\/..\/output\/smoke\/contracts_20260421_150022_3f4af5\/cache\\cache_b079ab2201c676e7_f5715a1af696ce83.result.json",
    "texto_extraido_path": "C:\\Users\\basil\\Documents\\GitHub\\Proyecto-Acelerador\\meritos\\scraping\\tools\/..\/output\/smoke\/contracts_20260421_150022_3f4af5\/cache\\cache_b079ab2201c676e7_f5715a1af696ce83.text.txt",
    "trace_path": "C:\\Users\\basil\\Documents\\GitHub\\Proyecto-Acelerador\\meritos\\scraping\\src\/..\/output\/logs\/contracts_sample_20260421_150022_d66210ba.20260421_150022.trace.json",
    "log_path": "C:\\Users\\basil\\Documents\\GitHub\\Proyecto-Acelerador\\meritos\\scraping\\tools\/..\/output\/smoke\/contracts_20260421_150022_3f4af5\/jobs\/logs\/job_20260421_150022_6cf5799f.log",
    "aneca_canonical_path": "C:\\Users\\basil\\Documents\\GitHub\\Proyecto-Acelerador\\meritos\\scraping\\src\/..\/output\/json\/contracts_sample_20260421_150022_d66210ba.aneca.canonico.json",
    "aneca_canonical_ready": true,
    "aneca_canonical_validation_status": "valido_con_advertencias",
    "aneca_canonical_validation_errors": [],
    "aneca_canonical_validation_warnings": [
        "comite_no_identificado"
    ],
    "tiempo_total_ms": 944.08,
    "estado_cache": "valida",
    "error_parcial": true,
    "pipeline_log_path": "C:\\Users\\basil\\Documents\\GitHub\\Proyecto-Acelerador\\meritos\\scraping\\src\/..\/output\/logs\/contracts_sample_20260421_150022_d66210ba.20260421_150022.pipeline.log",
    "motivo_invalidation": null,
    "validation_status": "valido_con_advertencias",
    "validation_errors": [],
    "validation_warnings": [
        "resultado_con_campos_extraidos_parciales"
    ]
}